{
  "schema": "dokion.provenance.v1",
  "package_id": "dokion-labs/secure-web-app",
  "version": "1.2.3",
  "manifest": {
    "expected_digest": "sha256:bbbbbbbbbbbbbbbbbbbbbbbbbbbbbbbbbbbbbbbbbbbbbbbbbbbbbbbbbbbbbbbb",
    "integrity_state": "UNAVAILABLE"
  },
  "artifact": {
    "expected_digest": "sha256:dddddddddddddddddddddddddddddddddddddddddddddddddddddddddddddddd",
    "integrity_state": "NOT_CHECKED"
  },
  "registry_source": {
    "source_id": "example.registry",
    "transport": "https",
    "immutable_source_state": "UNAVAILABLE",
    "registry_index_digest": "sha256:aaaaaaaaaaaaaaaaaaaaaaaaaaaaaaaaaaaaaaaaaaaaaaaaaaaaaaaaaaaaaaaa"
  },
  "publisher_identity": { "state": "UNAVAILABLE" },
  "signature": { "state": "UNAVAILABLE" },
  "compatibility": { "state": "UNKNOWN", "dokion_version": "0.3.0" },
  "freshness": { "state": "UNAVAILABLE" },
  "deprecation": { "state": "CURRENT" },
  "revocation": { "state": "UNKNOWN" },
  "observed_at": "2026-08-01T07:20:00Z",
  "authority": {
    "selection_authority": false,
    "substitution_authority": false,
    "installation_authority": false,
    "activation_authority": false,
    "execution_authority": false
  }
}
